{"schema_version":"0.1","incident_id":"inc_01J000000000000000000001","property_id":"prp_01J000000000000000000001","incident_class":"critical_device_offline","severity":"high","state":"open","confirmed_observation":"The selected front door camera did not respond to local health checks.","interpretation":"The camera may be powered off, disconnected, or unreachable through the local network.","limitations":"The system cannot determine the physical cause unknown until additional evidence is available.","recommended_action":"Inspect the device and local network when safe to do so.","confidence":"medium","started_at":"2026-07-14T12:00:00+00:00"}
